{
  "dataset": "filter_facets",
  "analytics_as_of": "2026-03-20T20:14:44.603849Z",
  "as_of": "2026-03-20T20:14:44.603849Z",
  "version": 1,
  "surfaces": {
    "home": {
      "kind": [
        {
          "value": "media_reference",
          "label": "Media Reference",
          "count": 1195
        },
        {
          "value": "proposal",
          "label": "Proposal",
          "count": 222
        },
        {
          "value": "community_reference",
          "label": "Community Reference",
          "count": 96
        },
        {
          "value": "payout",
          "label": "Payout",
          "count": 65
        },
        {
          "value": "delivery",
          "label": "Delivery",
          "count": 3
        },
        {
          "value": "project_update",
          "label": "Project Update",
          "count": 1
        }
      ],
      "status": [
        {
          "value": "executed",
          "label": "Executed",
          "count": 640
        },
        {
          "value": "closed",
          "label": "Closed",
          "count": 543
        },
        {
          "value": "defeated",
          "label": "Defeated",
          "count": 166
        },
        {
          "value": "active",
          "label": "Active",
          "count": 114
        },
        {
          "value": "cancelled",
          "label": "Cancelled",
          "count": 104
        },
        {
          "value": "completed",
          "label": "Completed",
          "count": 6
        },
        {
          "value": "succeeded",
          "label": "Succeeded",
          "count": 5
        },
        {
          "value": "in-progress",
          "label": "In Progress",
          "count": 4
        }
      ],
      "category": [
        {
          "value": "media",
          "label": "Media",
          "count": 755
        },
        {
          "value": "events",
          "label": "Events",
          "count": 214
        },
        {
          "value": "travel",
          "label": "Travel",
          "count": 167
        },
        {
          "value": "operations",
          "label": "Operations",
          "count": 133
        },
        {
          "value": "athlete-support",
          "label": "Athlete Support",
          "count": 116
        },
        {
          "value": "software",
          "label": "Software",
          "count": 65
        },
        {
          "value": "governance",
          "label": "Governance",
          "count": 29
        },
        {
          "value": "other",
          "label": "Other",
          "count": 6
        }
      ],
      "asset": [
        {
          "value": "USDC",
          "label": "USDC",
          "count": 97
        },
        {
          "value": "ETH",
          "label": "ETH",
          "count": 64
        },
        {
          "value": "SENDIT",
          "label": "SENDIT",
          "count": 17
        },
        {
          "value": "TOKEN-09E938",
          "label": "TOKEN 09E938",
          "count": 5
        },
        {
          "value": "TOKEN-4F6047",
          "label": "TOKEN 4F6047",
          "count": 3
        }
      ]
    },
    "proposals": {
      "status": [
        {
          "value": "closed",
          "label": "Closed",
          "count": 101
        },
        {
          "value": "executed",
          "label": "Executed",
          "count": 80
        },
        {
          "value": "defeated",
          "label": "Defeated",
          "count": 22
        },
        {
          "value": "cancelled",
          "label": "Cancelled",
          "count": 16
        },
        {
          "value": "active",
          "label": "Active",
          "count": 2
        },
        {
          "value": "succeeded",
          "label": "Succeeded",
          "count": 1
        }
      ],
      "category": [
        {
          "value": "media",
          "label": "Media",
          "count": 103
        },
        {
          "value": "events",
          "label": "Events",
          "count": 30
        },
        {
          "value": "travel",
          "label": "Travel",
          "count": 24
        },
        {
          "value": "athlete-support",
          "label": "Athlete Support",
          "count": 20
        },
        {
          "value": "operations",
          "label": "Operations",
          "count": 18
        },
        {
          "value": "software",
          "label": "Software",
          "count": 12
        },
        {
          "value": "governance",
          "label": "Governance",
          "count": 10
        },
        {
          "value": "other",
          "label": "Other",
          "count": 5
        }
      ],
      "platform": [
        {
          "value": "gnars.com",
          "label": "Gnars.com",
          "count": 121
        },
        {
          "value": "snapshot",
          "label": "Snapshot",
          "count": 101
        }
      ],
      "chain": [
        {
          "value": "base",
          "label": "Base",
          "count": 109
        },
        {
          "value": "snapshot",
          "label": "Snapshot",
          "count": 104
        },
        {
          "value": "ethereum",
          "label": "Ethereum",
          "count": 9
        }
      ]
    },
    "community": {
      "tribe": [
        {
          "value": "holder",
          "label": "Holder",
          "count": 1011
        },
        {
          "value": "delegate",
          "label": "Delegate",
          "count": 992
        },
        {
          "value": "contributor",
          "label": "Contributor",
          "count": 98
        },
        {
          "value": "proposer",
          "label": "Proposer",
          "count": 73
        },
        {
          "value": "recipient",
          "label": "Recipient",
          "count": 51
        },
        {
          "value": "athlete",
          "label": "Athlete",
          "count": 41
        },
        {
          "value": "builder",
          "label": "Builder",
          "count": 3
        },
        {
          "value": "member",
          "label": "Member",
          "count": 3
        }
      ],
      "status": [
        {
          "value": "active",
          "label": "Active",
          "count": 1180
        }
      ]
    },
    "projects": {
      "category": [
        {
          "value": "governance",
          "label": "Governance",
          "count": 1
        },
        {
          "value": "operations",
          "label": "Operations",
          "count": 1
        }
      ],
      "status": [
        {
          "value": "governance-active",
          "label": "Governance Active",
          "count": 1
        },
        {
          "value": "superseded",
          "label": "Superseded",
          "count": 1
        }
      ]
    },
    "treasury": {
      "asset": [
        {
          "value": "USDC",
          "label": "USDC",
          "count": 34
        },
        {
          "value": "ETH",
          "label": "ETH",
          "count": 22
        },
        {
          "value": "SENDIT",
          "label": "SENDIT",
          "count": 6
        },
        {
          "value": "TOKEN-09E938",
          "label": "TOKEN 09E938",
          "count": 2
        },
        {
          "value": "TOKEN-4F6047",
          "label": "TOKEN 4F6047",
          "count": 1
        }
      ],
      "status": [
        {
          "value": "executed",
          "label": "Executed",
          "count": 65
        }
      ],
      "chain": [
        {
          "value": "base",
          "label": "Base",
          "count": 63
        },
        {
          "value": "ethereum",
          "label": "Ethereum",
          "count": 1
        },
        {
          "value": "snapshot",
          "label": "Snapshot",
          "count": 1
        }
      ],
      "category": [
        {
          "value": "media",
          "label": "Media",
          "count": 35
        },
        {
          "value": "events",
          "label": "Events",
          "count": 7
        },
        {
          "value": "operations",
          "label": "Operations",
          "count": 6
        },
        {
          "value": "travel",
          "label": "Travel",
          "count": 6
        },
        {
          "value": "software",
          "label": "Software",
          "count": 5
        },
        {
          "value": "athlete-support",
          "label": "Athlete Support",
          "count": 3
        },
        {
          "value": "governance",
          "label": "Governance",
          "count": 3
        }
      ]
    },
    "timeline": {
      "kind": [
        {
          "value": "proposal",
          "label": "Proposal",
          "count": 222
        },
        {
          "value": "milestone",
          "label": "Milestone",
          "count": 2
        },
        {
          "value": "delivery",
          "label": "Delivery",
          "count": 1
        },
        {
          "value": "planning",
          "label": "Planning",
          "count": 1
        }
      ],
      "status": [
        {
          "value": "closed",
          "label": "Closed",
          "count": 101
        },
        {
          "value": "executed",
          "label": "Executed",
          "count": 80
        },
        {
          "value": "defeated",
          "label": "Defeated",
          "count": 22
        },
        {
          "value": "cancelled",
          "label": "Cancelled",
          "count": 16
        },
        {
          "value": "active",
          "label": "Active",
          "count": 2
        },
        {
          "value": "completed",
          "label": "Completed",
          "count": 2
        },
        {
          "value": "in-progress",
          "label": "In Progress",
          "count": 2
        },
        {
          "value": "succeeded",
          "label": "Succeeded",
          "count": 1
        }
      ]
    }
  }
}
